<?xml version="1.0" encoding="UTF-8"?>
<cartelera ciudad="Vigo" xsi:noNamespaceSchemaLocation="cartelera.xsd" xmlns:xsi="http://www.w3.org/2001/XMLSchema-instance">
	<peliculas>
		<pelicula idPelicula="P1234">
			<titulo>La invención de Hugo</titulo>
			<director>Martin Scorsese</director>
		</pelicula>
		<pelicula idPelicula="P2345">
			<titulo>John Carter</titulo>
			<director>Andrew Stanton</director>
		</pelicula>
		<pelicula idPelicula="P3456">
			<titulo>Intocable</titulo>
			<director>Olivier Nakache</director>
		</pelicula>
	</peliculas>
	<cines>
		<cine>
			<nombre>Avenida</nombre>
			<sesiones sala="S1" pelicula="P1234"/>
			<sesiones sala="S5" pelicula="P3456"/>
		</cine>
		<cine>
			<nombre>Pequeño cine</nombre>
			<sesiones sala="S2" pelicula="P2345"/>
		</cine>
	</cines>
</cartelera>